video_url,user_url,username,title,view_num,created_at,shortdesc,collected_at
/watch?v=XlEIkxVzVrQ&pp=ygUVYXVzdGluIGhvdXNpbmcgY3Jpc2lz,/@MHFIN,MHFIN,Austin Housing Crash: Phase 2 Has Finally Started,58K,2 months,See Foreclosure Listings → Statewide Texas: https://www.foreclosure.com/state/tx?rsp=3670.,2026-02-03 04:15:46.707247
/shorts/YeqdZ5Lvtk4,/@ReventureConsulting,Reventure Consulting,"$100,000 price cuts in Austin, TX (the crash is getting real)",27K,8 days,"Join 1000000+ users using Reventure App to find undervalued markets, avoid housing bubbles, and plan their next move.",2026-02-03 04:15:46.708500
/watch?v=vVEY4pUx5uQ&pp=ygUVYXVzdGluIGhvdXNpbmcgY3Jpc2lz,/@ModernEconomist,Modern Economy,BREAKING: The Austin & Dallas Texas Crash Is Far Worse Than Anyone Imagined,3.6K,2 months,"Texas's two biggest housing powerhouses, Austin and Dallas, are finally feeling the pressure. In this in-depth report, we uncover ...",2026-02-03 04:15:46.709570
/watch?v=gXF_CBK1A8s&pp=ygUVYXVzdGluIGhvdXNpbmcgY3Jpc2lz,/@FOX7Austin,FOX 7 Austin,Austin housing market: Rent prices fall but tenants see little relief | FOX 7 Austin,4K,3 months,"Rent prices in Austin have dipped slightly, but rising fees and income-linked rent limits mean many residents are still struggling to ...",2026-02-03 04:15:46.711752
/shorts/EyHbqwuTGQQ,/@DeepResearchRealEstate,Deep Research Real Estate,Why Austin’s Housing Market Is Falling Apart,1.5K,6 months,"Austin's housing boom has taken a wild turn — and it's causing quite a stir in Austin, Texas! Prices are plummeting, tech jobs are ...",2026-02-03 04:15:53.382538
/watch?v=pQjXjmwfYmE&pp=ygUVYXVzdGluIGhvdXNpbmcgY3Jpc2lz,/@StatesExposed,Engineer Max,Governor Of Texas PANICS After Tech Layoffs CRASH Austin Real Estate Market!,283K,2 months,Governor Of Texas PANICS After Tech Layoffs CRASH Austin Real Estate Market! Austin's once-explosive housing market is ...,2026-02-03 04:15:53.384108
/shorts/Vlie3aupkro,/@ReventureConsulting,Reventure Consulting,"Austin, TX is crashing. Just how bad will it get?",27K,3 months,"Just how bad is Austin, Texas's housing crash going to get? Since mid-2022, home values are down 23%, and rents are down ...",2026-02-03 04:15:53.387302
/watch?v=Ml4U1XetI_o&pp=ygUVYXVzdGluIGhvdXNpbmcgY3Jpc2lz,/@tuckersellsaustintx,"Tucker Cummings - Austin, TX Real Estate","Austin, TX Housing Market 2025: Real Data Breakdown and What to Expect!",834,2 months,"Is the Austin, TX housing market really crashing, stabilizing, or heating back up? In this video, I break down the real 2025 Austin ...",2026-02-03 04:15:53.389236
/watch?v=24xj_sfdTWc&pp=ygUVYXVzdGluIGhvdXNpbmcgY3Jpc2lz,/@FOX7Austin,FOX 7 Austin,Will this new program solve Austin's housing crisis? | FOX 7 Austin,381,2 years,Austin City Council member Ryan Alter joins FOX 7 Austin's Mike Warren to discuss the impact of a new density bonus program ...,2026-02-03 04:15:53.391633
/watch?v=p5tuXE3jxEY&pp=ygUVYXVzdGluIGhvdXNpbmcgY3Jpc2lz,/@JordanSuber-real-estate,Jordan Suber | Real Estate Investing,Is the Austin Texas Housing Market Crashing? (2026 Forecast),148,2 months,Book your FREE consultation now: https://calendly.com/jordansuberrealtor/real-estate-consultation And learn more about us here: ...,2026-02-03 04:15:53.393764
/shorts/pU1l0Db83U4,/@The_Wilson_Way,Alisha & Matthew Wilson | Austin Suburbs Realtors,Is The Austin Texas Housing Market About To CRASH In 2025?,1K,3 months,Home prices are actually up 61% since 2020… but don't grab your crash helmet just yet. The 2025 slowdown isn't 2008 all ...,2026-02-03 04:15:53.397005
/shorts/L6MQQfGv2jU,/@ReventureConsulting,Reventure Consulting,No one expected this. (40% condo crash in Austin TX),29K,6 days,"Join 1000000+ users using Reventure App to find undervalued markets, avoid housing bubbles, and plan their next move.",2026-02-03 04:15:53.399856
/watch?v=RDjOzJdVEHY&pp=ygUVYXVzdGluIGhvdXNpbmcgY3Jpc2lz,/@FOX7Austin,FOX 7 Austin,"Austin “is facing an unprecedented housing crisis,” city council says I FOX 7 Austin",510,4 years,"The City of Austin needs at least 135000 additional housing units in the city over the next decade to meet housing needs, ...",2026-02-03 04:15:53.401292
/watch?v=xpVGa11Q3Yk&pp=ygUVYXVzdGluIGhvdXNpbmcgY3Jpc2lz,/@KVUETV,KVUE,Boomtown 2040: Austin realtors worried about housing crisis | KVUE,335,6 years,The city is seeing record home sales and record low home inventory. STORY: ...,2026-02-03 04:15:53.403763
/watch?v=rEp25FF61hc&pp=ygUVYXVzdGluIGhvdXNpbmcgY3Jpc2lz0gcJCZEKAYcqIYzv,/@ihearttheatx,"Ashley Brinkman | Austin, TX Real Estate",MASTER the Secrets of the 2026 Austin Housing Market Predictions!,1.4K,1 month,MASTER the Secrets of the 2026 Austin Housing Market Predictions! Master the latest insights on the 2026 housing market in ...,2026-02-03 04:15:53.406363
/watch?v=Xtfn-bFhG9A&pp=ygUVYXVzdGluIGhvdXNpbmcgY3Jpc2lz,/@kxan_news,KXAN,"In the thick of a housing crisis, is Austin's real estate market racially equitable?",572,2 years,"There are systemic factors that affect racial equality in real estate, according to researchers. On Wednesday, the Urban Land ...",2026-02-03 04:15:53.407706
/watch?v=j5nOFrVAPWc&pp=ygUVYXVzdGluIGhvdXNpbmcgY3Jpc2lz,/@kxan_news,KXAN,Waitlists open up for Austin affordable housing — why not everyone will get on it,754,3 years,"In a city grappling with a housing crisis, there's a small window of opportunity to — maybe — get an affordable home. Read more ...",2026-02-03 04:15:53.409018
/watch?v=MGjFel6DnLw&pp=ygUVYXVzdGluIGhvdXNpbmcgY3Jpc2lz,/@AdamInAustin,Living in Austin With Adam in Austin,Something Weird Is Happening In The Austin Housing Market,27K,1 month,Book a FREE Call with me here - https://linktr.ee/adaminaustin Call/Text Direct at (512) 765-4086 Email: ...,2026-02-03 04:15:53.413265
/watch?v=tqQG6IjB4yU&pp=ygUVYXVzdGluIGhvdXNpbmcgY3Jpc2lz,/@kxan_news,KXAN,Home builders say construction ban will worsen Austin's housing crisis,494,5 years,Austin home builders say residential construction should continue while the Stay Home – Work Safe order is in place.,2026-02-03 04:15:53.414679
/shorts/C__Gcm39ka4,/@RealEstateMarketWatch,Real Estate Market Watch,Austin's Housing Market Just Broke Records!,2.3K,4 months,"Austin's Housing Market Just Broke Records! Austin, Texas — long known for its slogan “Keep Austin Weird” — has now taken on ...",2026-02-03 04:16:01.213300
/watch?v=uzzGz4yChC8&pp=ygUVYXVzdGluIGhvdXNpbmcgY3Jpc2lz,/@FOX7Austin,FOX 7 Austin,An in-depth look at Austin's housing shortage | FOX 7 Austin,872,3 years,Supply chain issues and land development codes are putting a strain on home builders and the housing shortage.,2026-02-03 04:16:01.214781
/watch?v=V6G8b5xMI8c&pp=ygUVYXVzdGluIGhvdXNpbmcgY3Jpc2lz,/@FOX7Austin,FOX 7 Austin,President Trump proposes 50-year mortgage to tackle affordability crisis | FOX 7 Austin,491,2 months,"President Trump is tackling the affordability crisis with a focus on lowering the cost of housing, and his first proposal is the creation ...",2026-02-03 04:16:01.216305
/watch?v=WGPhn1ViYyo&pp=ygUVYXVzdGluIGhvdXNpbmcgY3Jpc2lz0gcJCZEKAYcqIYzv,/@kxan_news,KXAN,"Housing crisis affecting tiny, mobile homes",1.1K,3 years,"KXAN's Jennifer Sanders reports that rising home costs are also happening with tiny and mobile homes, putting the squeeze to ...",2026-02-03 04:16:01.219025
/watch?v=tmGTEydm0Gc&pp=ygUVYXVzdGluIGhvdXNpbmcgY3Jpc2lz,/@kxan_news,KXAN,Housing affordability is city’s #1 challenge — a threat to Austin as we know it,1K,4 years,Austin's affordability crisis is reaching a boiling point. READ MORE: ...,2026-02-03 04:16:01.220651
/watch?v=jL-bPAJlat0&pp=ygUVYXVzdGluIGhvdXNpbmcgY3Jpc2lz,/@SachsRealty,Sachs Realty,Fmr. Asst. Sec. of HUD Talks About Housing,69K,9 days,Looking to buy a house? Learn how step-by-step! Get Todd's Simple Home Buying Course today: ...,2026-02-03 04:16:01.224297
/watch?v=cNSZpOUR-Bk&pp=ygUVYXVzdGluIGhvdXNpbmcgY3Jpc2lz,/@kxan_news,KXAN,"Amid its housing shortage, Austin is trying to keep up with permits to build more",403,4 years,"Amid its housing shortage, Austin is trying to keep up with permits to build more.",2026-02-03 04:16:01.225894
/watch?v=WTN2lBKawsQ&pp=ygUVYXVzdGluIGhvdXNpbmcgY3Jpc2lz,/@jeffstensland,Jeff Stensland,Sizing Up Austin's Housing Crisis,204,6 years,"Austin's history of redlining may be off the books, but some neighborhoods continue to get city leaders to limit the type of ...",2026-02-03 04:16:01.227620
/watch?v=l9_VL2z6Dso&pp=ygUVYXVzdGluIGhvdXNpbmcgY3Jpc2lz,/@SFSCharles,Charles Lewis -  Buying & Selling Homes in Austin,Austin Texas Housing Affordability Crisis,511,4 years,"Austin Texas is facing a housing affordability crisis, primarily because a surge in buyer demand this past year drove up property ...",2026-02-03 04:16:01.229003
/watch?v=G2-NXKYTVBU&pp=ygUVYXVzdGluIGhvdXNpbmcgY3Jpc2lz,/@kxan_news,KXAN,Leadership Austin Engage Breakfast: Housing crisis,51,12 years,Real estate industry leaders came together to talk about the need for changes in the land development code and affordable and ...,2026-02-03 04:16:01.231287
/watch?v=URN6vGXCwd4&pp=ygUVYXVzdGluIGhvdXNpbmcgY3Jpc2lz0gcJCZEKAYcqIYzv,/@ReventureReports,Reventure Housing Reports,Austin's housing market on the verge of rebounding (2025 market update),18K,6 months,"Austin's real estate market is getting a lot cheaper for home buyers in 2025 and into 2026, with home values now down 21.5% ...",2026-02-03 04:16:01.232598
/watch?v=38ACs0gNZrA&pp=ygUVYXVzdGluIGhvdXNpbmcgY3Jpc2lz,/@uptin,Uptin,Silicon Valley Moved to Austin. Then Regretted It.,1.8M,7 months,Austin saw the biggest price drop in homes in the United States. So what's happening to the city that was luring Silicon Valley?,2026-02-03 04:16:01.233939
/watch?v=CdYQjCIKaoM&pp=ygUVYXVzdGluIGhvdXNpbmcgY3Jpc2lz0gcJCZEKAYcqIYzv,/@SFSCharles,Charles Lewis -  Buying & Selling Homes in Austin,Austin's Housing Crisis Just Got Solved - Shocking SAN MARCOS Solution,1K,3 years,"If you're overwhelmed with the high cost of housing in Austin, then you need to watch this video! San Marcos, TX has some ...",2026-02-03 04:16:01.236793
/watch?v=F9Z6aOlbH48&pp=ygUVYXVzdGluIGhvdXNpbmcgY3Jpc2lz,/@kxan_news,KXAN,Austin Board of Realtors dissects city's 'missing housing' crisis,407,2 years,"Emily Chenevert, CEO of the Austin Board of REALTORS, joined KXAN News to discuss the board's new research report diving ...",2026-02-03 04:16:01.239281
/shorts/IiNxLcX5qb4,/@ReventureConsulting,Reventure Consulting,"Home Builders just CRASHED the Austin, TX Housing Market",225K,2 years,"Home builders just crashed the Housing Market in Austin, TX, particularly in the outlying suburbs, where home prices are down ...",2026-02-03 04:16:01.240819
/watch?v=5065jD4KqsA&pp=ygUVYXVzdGluIGhvdXNpbmcgY3Jpc2lz,/@SFSCharles,Charles Lewis -  Buying & Selling Homes in Austin,Fear Invades AUSTIN Housing Market - Find Out Why!,366,2 years,"Austin has been experiencing rapid growth and this has led to an influx of new homeowners in the city limits. However, the ...",2026-02-03 04:16:01.243707
/watch?v=frSfNVbJ1eo&pp=ygUVYXVzdGluIGhvdXNpbmcgY3Jpc2lz,/@FOX7Austin,FOX 7 Austin,Housing crisis: Austin leaders work towards land development rewrite,177,5 years,Austin city council member Jimmy Flannigan joins Marcel Clarke to discuss the land development code revisions. FULL STORY: ...,2026-02-03 04:16:01.247701
/watch?v=AaXXbeZd-z4&pp=ygUVYXVzdGluIGhvdXNpbmcgY3Jpc2lz,/@KVUETV,KVUE,Gov. Abbott signs bills aimed at combating Texas' housing crisis,219,5 months,Governor Abbott said the laws are meant to make home ownership more affordable and accessible for families. More coverage: ...,2026-02-03 04:16:01.249107
/watch?v=slatKWANlHc&pp=ygUVYXVzdGluIGhvdXNpbmcgY3Jpc2lz,/@kxan_news,KXAN,Thousands flooding to Austin for events are staying in unlicensed short-term rentals,1.3K,3 years,... and apartments that may be suitable housing for Austinites in the midst of a housing crisis don't get flipped to short-term rentals.,2026-02-03 04:16:01.250490
/watch?v=pBwPz1TCNwE&pp=ygUVYXVzdGluIGhvdXNpbmcgY3Jpc2lz,/@FoxBusiness,Fox Business,HOUSING CRISIS EXPLODES: Gen Z chooses stocks over the American dream,99K,2 months,'The Big Money Show' panel discusses how skyrocketing housing costs are pushing young Americans out of homeownership and ...,2026-02-03 04:16:09.494452
/watch?v=1aBz-E9zRqM&pp=ygUVYXVzdGluIGhvdXNpbmcgY3Jpc2lz,/@KVUETV,KVUE,Austin Board of Realtors releases report on housing gaps | KVUE,529,2 years,"""The Truth About Austin's Missing Houses"" found that households making less than $20000 annually are especially struggling ...",2026-02-03 04:16:09.498449
/watch?v=934O11qFD7U&pp=ygUVYXVzdGluIGhvdXNpbmcgY3Jpc2lz,/@JeremyAKnight,Jeremy Knight - Austin Texas,Housing Crisis? What Tesla's HQ Moving To Austin Means For The Future.,6.3K,4 years,What does Tesla moving its headquarters mean for the Austin Real Estate market and the future of Austin? Follow me on ...,2026-02-03 04:16:09.502535
/watch?v=_c-tO8P68jg&pp=ygUVYXVzdGluIGhvdXNpbmcgY3Jpc2lz,/@ignitenational4103,IGNITE National,The Austin Housing Crisis: Local Leadership Panel,45,4 years,... society and so the most direct one right would be our housing crisis one of those tentacles but within our housing crisis we have ...,2026-02-03 04:16:09.503930
/watch?v=IWlgLznGVa8&pp=ygUVYXVzdGluIGhvdXNpbmcgY3Jpc2lz0gcJCZEKAYcqIYzv,/@KVUETV,KVUE,Realtors say housing shortage in Northwest Austin is getting worse as demand increases | KVUE,129,6 years,"""Northwest Austin...will become somewhat of a second downtown for Austin because of the concentration of tech and the ...",2026-02-03 04:16:09.507560
/watch?v=uCeX8IpvNLc&pp=ygUVYXVzdGluIGhvdXNpbmcgY3Jpc2lz,/@JordanSellsATX,Austin Relocation Guide w/ Jordan Brown,"The Great Austin, TX Housing Crisis of 2024?",87,2 years,"Moving to Austin, Texas? Click Here: https://linktr.ee/jordansellsatx Austin, TX was the number 5 most moved to city in 2023.",2026-02-03 04:16:09.508945
/watch?v=OQFyhNJtxuw&pp=ygUVYXVzdGluIGhvdXNpbmcgY3Jpc2lz,/@WattersInternationalRealty,Watters International Realty,Greater Austin Real Estate Agent: What We Learned from the Housing Crisis,133,10 years,"The Austin market is in great shape right now and the national economy has rebounded, making now a great time to talk about ...",2026-02-03 04:16:09.514179
/watch?v=gG7IGh1D9Nk&pp=ygUVYXVzdGluIGhvdXNpbmcgY3Jpc2lz,/@kxan_news,KXAN,Austin Mayor discusses affordable housing crisis with White House,76,9 years,Talks about his take aways from South By South Lawn.,2026-02-03 04:16:09.517423
/watch?v=CfDvZknTVgY&pp=ygUVYXVzdGluIGhvdXNpbmcgY3Jpc2lz,/@KVUETV,KVUE,Analyst warns of Airbnb collapse in Austin | KVUE,59K,2 years,The average short-term rental in Austin brought in almost $2000 less in 2023 than it did in 2022. STORY: ...,2026-02-03 04:16:09.518877
/watch?v=UhpyqJbsBVI&pp=ygUVYXVzdGluIGhvdXNpbmcgY3Jpc2lz,/@CBSAustin,CBS Austin,First Affordable Housing Community In Downtown Austin in 45 Years,211,11 years,http://www.keyetv.com/ The cost of living in Downtown Austin is about to get more affordable. A new apartment complex is going ...,2026-02-03 04:16:09.521368
/watch?v=0LAQ2uAJax0&pp=ygUVYXVzdGluIGhvdXNpbmcgY3Jpc2lz,/@FOX7Austin,FOX 7 Austin,Austin man falls victim to affordable housing crisis | FOX 7 Austin,2.6K,2 years,An Austin man found himself couch surfing and living out of his truck after falling victim to the affordable housing crisis. A new ...,2026-02-03 04:16:09.522820
/watch?v=j2ZXzQAB6gc&pp=ygUVYXVzdGluIGhvdXNpbmcgY3Jpc2lz,/@kxan_news,KXAN,‘That’s not fair housing’: Latest issues related to housing discrimination claims in Austin,457,2 years,"Knowing your rights is critical, to make sure you're not being discriminated against in the housing market. Read more: ...",2026-02-03 04:16:09.526292
/watch?v=WzPazMeCzKE&pp=ygUVYXVzdGluIGhvdXNpbmcgY3Jpc2lz,/@JeremyAKnight,Jeremy Knight - Austin Texas,Austin Housing Market Crash Over?,3.2K,4 years,Austin Home Prices ROBOUND In October! Should we stop talking about the market crash? Follow me on Instagram ...,2026-02-03 04:16:09.527776
/watch?v=_l-OQRYXGk4&pp=ygUVYXVzdGluIGhvdXNpbmcgY3Jpc2lz,/@kxan_news,KXAN,‘City-funded chaos’: Concerns raised about north Austin affordable housing units,1.2K,3 years,People living near a property in north Austin formerly known as the Raintree Apartments — now called the Redfield 34 Apartments ...,2026-02-03 04:16:09.529288
/watch?v=HSTR3iAsKOY&pp=ygUVYXVzdGluIGhvdXNpbmcgY3Jpc2lz,/@bukowskilawfirm,"Bukowski Law Firm, P.C.","Austin Texas, the affordable housing crisis continues. Will the $350mm bond help solve the issue?",9,3 years,Austin will have another housing bond on the ballot this November. It will likely be a $350 million bond to allow the city to build ...,2026-02-03 04:16:09.531058
/watch?v=QQC42aTJ5mw&pp=ygUVYXVzdGluIGhvdXNpbmcgY3Jpc2lz,/@ReventureConsulting,Reventure Consulting,Texas is about to get cheap.,93K,Streamed 3 months,Access our price forecast for your market at https://www.reventure.app.Texas' housing market is on the verge of a massive shift in ...,2026-02-03 04:16:09.532649
/watch?v=fvPUnYbQ5Ys&pp=ygUVYXVzdGluIGhvdXNpbmcgY3Jpc2lz,/@KVUETV,KVUE,South Austin zoning ordinance may cause housing deficit | KVUE,1.4K,3 years,A South Austin neighborhood recognized as a nationally historic neighborhood is worried that current zoning ordinances are ...,2026-02-03 04:16:09.534070
/watch?v=WZH0A34zAJs&pp=ygUVYXVzdGluIGhvdXNpbmcgY3Jpc2lz,/@theelitestrategist,Martin Perdomo - The Elite Strategist,East Austin Housing Crisis Worsening? | Real Estate Market Update,56,1 year,Are you looking for a new place to live in East Austin? Get ready for some exciting changes! Two new apartment developments ...,2026-02-03 04:16:09.535573
/watch?v=x2__-CWXiug&pp=ygUVYXVzdGluIGhvdXNpbmcgY3Jpc2lz,/@DiscoverTheCities2025,Discover The Cities,Texas Housing Bubble 2026: 10 Cities on the Edge of Collapse,5.7K,6 days,"Is the Texas housing boom finally starting to crack? In this episode, Discover the Cities counts down 10 Texas cities where home ...",2026-02-03 04:16:09.536888
/watch?v=392dKRHplR0&pp=ygUVYXVzdGluIGhvdXNpbmcgY3Jpc2lz,/@KVUETV,KVUE,Boomtown 2040: Austin's missing middle class | KVUE,3.2K,6 years,"One developer is trying to tackle the housing crisis for a group some call ""the missing middle."" STORY: ...",2026-02-03 04:16:09.539493
/watch?v=ErTstBnGWxU&pp=ygUVYXVzdGluIGhvdXNpbmcgY3Jpc2lz,/@TexasNewsPrimetime,Texas News PrimeTime,UT Housing Crisis // PrimeTime Reports,88,3 years,LIVE MONDAYS AT 9PMc | Texas News PrimeTime is the flagship weekly evening newscast of Texas Student Television at the ...,2026-02-03 04:16:18.060594
/shorts/bb_9sN-ubMo,/@CBSAustin,CBS Austin,City's largest housing project breaks ground: 126 affordable homes coming to SE Austin,916,2 years,"More affordable homes are coming to Southeast Austin. On Friday, Austin Habitat for Humanity broke ground at Persimmon Point, ...",2026-02-03 04:16:18.062209
/watch?v=tajGE4V_7Wg&pp=ygUVYXVzdGluIGhvdXNpbmcgY3Jpc2lz,/@CBSAustin,CBS Austin,Austin pledges $350M to fight homelessness,790,1 year,The Austin City Council voted Thursday afternoon to make homelessness a top financial priority for the city. The resolution directs ...,2026-02-03 04:16:18.063596
/watch?v=YZ9H2IEMDao&pp=ygUVYXVzdGluIGhvdXNpbmcgY3Jpc2lz,/@greaterthanaustinrealestate,Greater Than Austin Real Estate Round Rock+Beyond,Austin housing market is about to crash??,402,4 years,"Rumor has it the Austin housing market is heading towards a crash. Is this true and if so, why or why not. Austin real estate has ...",2026-02-03 04:16:18.065478
/watch?v=CRyQNulKvm8&pp=ygUVYXVzdGluIGhvdXNpbmcgY3Jpc2lz,/@KVUETV,KVUE,New City of Austin program aims to help residents at risk of being forced out of their homes | KVUE,5K,2 years,"The Displacement Prevention Navigator Pilot Program will bring in what they call ""Navigators,"" who will go door-to-door to help ...",2026-02-03 04:16:18.069165
/watch?v=2ksNHk1qDkg&pp=ygUVYXVzdGluIGhvdXNpbmcgY3Jpc2lz,/@ShannonGreenRealtor,Living In Austin TX | Shannon Green,Austin Homes for Sale in CRISIS?? 😱 | MEGA Austin Texas Real Estate Market Update June 2025,838,6 months,"Inventory is rising, sellers are holding out for higher prices, and buyers are getting more selective — what does this all mean for ...",2026-02-03 04:16:18.070465
/watch?v=qqx6u9sayTM&pp=ygUVYXVzdGluIGhvdXNpbmcgY3Jpc2lz,/@SFSCharles,Charles Lewis -  Buying & Selling Homes in Austin,Austin Real Estate Crisis: Contracts Cancelled & Demand Plummeting!,989,3 years,"In this video, we're going to discuss the Austin real estate crisis and how it's impacting the market. As you probably know, the ...",2026-02-03 04:16:18.071741
/shorts/2kUnIUsV_TM,/@adriennesavenue,Adrienne's Avenue,The REAL Truth About Housing Market Changes in Austin,567,10 months,"The Austin texas housing market continues to experience significant shifts, with dramatic changes in property value across the ...",2026-02-03 04:16:18.076797
/watch?v=azmSH4cPccg&pp=ygUVYXVzdGluIGhvdXNpbmcgY3Jpc2lz,/@alexandergalor5755,Alexander Galor,"Austin, Texas' Housing Crisis 2019 - Current Event #2",12,6 years,This video was made for Prof. Reyna's T/Th 12:00pm class - fall semester 2019.,2026-02-03 04:16:18.078059
/watch?v=X3wdcH5cY-Q&pp=ygUVYXVzdGluIGhvdXNpbmcgY3Jpc2lz,/@SFSCharles,Charles Lewis -  Buying & Selling Homes in Austin,Will the Austin Housing Market Crash in 2022?,684,4 years,"Bidding wars defined the 2021 Austin housing market, but will it all finally crash in 2022? At a national level, home prices rose by ...",2026-02-03 04:16:18.080012
/watch?v=KsvrbDcgA9A&pp=ygUVYXVzdGluIGhvdXNpbmcgY3Jpc2lz0gcJCZEKAYcqIYzv,/@FOX7Austin,FOX 7 Austin,Austin City Council approves $350M affordable housing bond | FOX 7 Austin,363,3 years,The bond was approved to be voted on by citizens in the upcoming November election. #FOX7Austin brings you the important ...,2026-02-03 04:16:18.081276
/watch?v=vdzJ2UbXNgE&pp=ygUVYXVzdGluIGhvdXNpbmcgY3Jpc2lz,/@theclrsalesgroupaustin,The CLR Sales Group,Whats Happening in Austin Part 2: Are Homes in Austin Becoming Unaffordable?,23,4 years,Climbing prices in Austin Texas due to high demand!,2026-02-03 04:16:18.084669
/watch?v=tUGO7RUcaN0&pp=ygUVYXVzdGluIGhvdXNpbmcgY3Jpc2lz,/@rennerrealty,rennerrealty,The Coming Housing Shortage - Austin Rental Demand SURGES!,8.3K,14 years,In most areas of Austin we have less than a one month supply of rental homes. There is a feeding frenzy on rentals. Rents are ...,2026-02-03 04:16:18.086010
/watch?v=76RqJEA91Gg&pp=ygUVYXVzdGluIGhvdXNpbmcgY3Jpc2lz,/@FOX7Austin,FOX 7 Austin,"City leaders react to Austin receiving lower ranking on ""Best Places to Live in the U.S."" list | FOX",192,2 years,City leadership cites affordability and the ongoing housing crisis as factors that ranked Austin at number 40 on the list.,2026-02-03 04:16:18.087349
/watch?v=VjSkDMIBixc&pp=ygUVYXVzdGluIGhvdXNpbmcgY3Jpc2lz,/@JeremyAKnight,Jeremy Knight - Austin Texas,"Austin Housing CRASH Over! Or, Still To Come?",3.4K,3 years,movingtoaustin #homebuying #crash The Knight Group are a Platinum Top 50 husband/wife Real Estate Team helping over 70 ...,2026-02-03 04:16:18.089059
/watch?v=o8-q0W2y4bY&pp=ygUVYXVzdGluIGhvdXNpbmcgY3Jpc2lz,/@bukowskilawfirm,"Bukowski Law Firm, P.C.",Austin housing crisis: Home2 development code could impact home values in Austin neighborhoods,14,1 year,Austin Takes Bold Step Toward Affordability with HOME 2 Passage Austin residents eager for a solution to the city's skyrocketing ...,2026-02-03 04:16:18.092399
/watch?v=bA32176pXfM&pp=ygUVYXVzdGluIGhvdXNpbmcgY3Jpc2lz,/@FOX7Austin,FOX 7 Austin,Discussion: Musicians struggling with rising housing prices I FOX 7 Austin,139,4 years,The City of Austin recently determined that there is a need to build at least 135000 additional housing units over the next decade.,2026-02-03 04:16:18.094190
/watch?v=8JXUKiRmLJo&pp=ygUVYXVzdGluIGhvdXNpbmcgY3Jpc2lz,/@realestatemindset,Real Estate Mindset,BREAKING!! Housing Market CRASH in AUSTIN TX CONFIRMED,23K,3 years,"BREAKING!! Housing Market CRASH in AUSTIN TX CONFIRMED Houston, San Antonio, Austin and Dallas Texas. Email my team ...",2026-02-03 04:16:18.096232
/watch?v=T4WYCwChkqU&pp=ygUVYXVzdGluIGhvdXNpbmcgY3Jpc2lz,/@KVUETV,KVUE,Zoning program aiming to let developers build higher in exchange for affordable housing,589,1 year,The DB90 program replaces similar zoning plans struck down by a county district judge last year. Read more: ...,2026-02-03 04:16:18.097575
